{
  "format_version": 2,
  "generated_from": [
    "spec/firmware.json",
    "spec/fan_profiles.json"
  ],
  "source": {
    "label": "ASF48100SU200_V8.16.9.bin",
    "product_model": "ASF48100U200-H",
    "firmware_label": "V8.16.9",
    "sha256": "d4b4f4590689ae2effedf40e3999da8d4b9dfdcac7a1eff4635d0eca6d644600",
    "size": 475136,
    "trailer_hex": "23016745ab89efcddcfe98ba00000000",
    "c28x_word_base": "0x84000",
    "tested_hardware_revision": "control panel V3.00; power amplifier board V3.02",
    "tested_updater": "iPower 2.1.2.0 for Windows"
  },
  "constraints": {
    "allowed_start_c": [
      35,
      40,
      45
    ],
    "allowed_max_c": [
      50,
      55,
      60,
      65,
      70
    ],
    "minimum_span_c": 10,
    "stop_delta_c": 3
  },
  "profile_aliases": {
    "fan35C_off32C": "fan35C_max60C_off32C",
    "fan40C_off37C": "fan40C_max65C_off37C"
  },
  "profiles": {
    "fan35C_max50C_off32C": {
      "start_c": 35,
      "max_c": 50,
      "stop_c": 32,
      "curve_origin_c": 35,
      "slope_f32": 0.46666666865348816,
      "patches": [
        {
          "offset": "0x24A04",
          "expected_hex": "c201",
          "replacement_hex": "5e01",
          "meaning": "CMP AR6: 450 to 350 deci-C"
        },
        {
          "offset": "0x24A12",
          "expected_hex": "a401",
          "replacement_hex": "4001",
          "meaning": "CMP AR6: 420 to 320 deci-C"
        },
        {
          "offset": "0x24B7A",
          "expected_hex": "7bf4",
          "replacement_hex": "73f7",
          "meaning": "MOVIZ curve slope high half for 0.46666666865348816"
        },
        {
          "offset": "0x24B7C",
          "expected_hex": "b0e849f8",
          "replacement_hex": "b0e8c9eb",
          "meaning": "ADDF32 curve origin: -450.0 to -350.0 deci-C"
        },
        {
          "offset": "0x24B80",
          "expected_hex": "0ae84be1",
          "replacement_hex": "0fe87b77",
          "meaning": "MOVXI curve slope low half for 0.46666666865348816"
        }
      ],
      "changed_offsets": [
        "0x24A04",
        "0x24A12",
        "0x24B7A",
        "0x24B7B",
        "0x24B7E",
        "0x24B7F",
        "0x24B80",
        "0x24B82",
        "0x24B83"
      ],
      "output_sha256": "b3b1f06579af8e35a374a858b642e6aafdd55f90bff7ddf4b8898c764f181618",
      "evidence": {
        "static_encoding": "confirmed-static",
        "candidate_identity": "confirmed-static",
        "runtime": "not-established",
        "runtime_document": null
      }
    },
    "fan35C_max55C_off32C": {
      "start_c": 35,
      "max_c": 55,
      "stop_c": 32,
      "curve_origin_c": 35,
      "slope_f32": 0.3499999940395355,
      "patches": [
        {
          "offset": "0x24A04",
          "expected_hex": "c201",
          "replacement_hex": "5e01",
          "meaning": "CMP AR6: 450 to 350 deci-C"
        },
        {
          "offset": "0x24A12",
          "expected_hex": "a401",
          "replacement_hex": "4001",
          "meaning": "CMP AR6: 420 to 320 deci-C"
        },
        {
          "offset": "0x24B7A",
          "expected_hex": "7bf4",
          "replacement_hex": "9bf5",
          "meaning": "MOVIZ curve slope high half for 0.3499999940395355"
        },
        {
          "offset": "0x24B7C",
          "expected_hex": "b0e849f8",
          "replacement_hex": "b0e8c9eb",
          "meaning": "ADDF32 curve origin: -450.0 to -350.0 deci-C"
        },
        {
          "offset": "0x24B80",
          "expected_hex": "0ae84be1",
          "replacement_hex": "09e89b99",
          "meaning": "MOVXI curve slope low half for 0.3499999940395355"
        }
      ],
      "changed_offsets": [
        "0x24A04",
        "0x24A12",
        "0x24B7A",
        "0x24B7B",
        "0x24B7E",
        "0x24B7F",
        "0x24B80",
        "0x24B82",
        "0x24B83"
      ],
      "output_sha256": "938af6805f4ace42775e7faefbfcef4608f69725f39a20412e5f98894392ae2a",
      "evidence": {
        "static_encoding": "confirmed-static",
        "candidate_identity": "confirmed-static",
        "runtime": "not-established",
        "runtime_document": null
      }
    },
    "fan35C_max60C_off32C": {
      "start_c": 35,
      "max_c": 60,
      "stop_c": 32,
      "curve_origin_c": 35,
      "slope_f32": 0.2800000011920929,
      "patches": [
        {
          "offset": "0x24A04",
          "expected_hex": "c201",
          "replacement_hex": "5e01",
          "meaning": "CMP AR6: 450 to 350 deci-C"
        },
        {
          "offset": "0x24A12",
          "expected_hex": "a401",
          "replacement_hex": "4001",
          "meaning": "CMP AR6: 420 to 320 deci-C"
        },
        {
          "offset": "0x24B7A",
          "expected_hex": "7bf4",
          "replacement_hex": "7bf4",
          "meaning": "MOVIZ curve slope high half for 0.2800000011920929"
        },
        {
          "offset": "0x24B7C",
          "expected_hex": "b0e849f8",
          "replacement_hex": "b0e8c9eb",
          "meaning": "ADDF32 curve origin: -450.0 to -350.0 deci-C"
        },
        {
          "offset": "0x24B80",
          "expected_hex": "0ae84be1",
          "replacement_hex": "0ae84be1",
          "meaning": "MOVXI curve slope low half for 0.2800000011920929"
        }
      ],
      "changed_offsets": [
        "0x24A04",
        "0x24A12",
        "0x24B7E",
        "0x24B7F"
      ],
      "output_sha256": "39b3c5cff7f6063e588f7e3f39ddba974e1c2a976df1a31dd239599d9ab35b1c",
      "evidence": {
        "static_encoding": "confirmed-static",
        "candidate_identity": "confirmed-static",
        "runtime": "runtime-observed",
        "runtime_document": "docs/runtime-validation.md"
      }
    },
    "fan35C_max65C_off32C": {
      "start_c": 35,
      "max_c": 65,
      "stop_c": 32,
      "curve_origin_c": 35,
      "slope_f32": 0.23333333432674408,
      "patches": [
        {
          "offset": "0x24A04",
          "expected_hex": "c201",
          "replacement_hex": "5e01",
          "meaning": "CMP AR6: 450 to 350 deci-C"
        },
        {
          "offset": "0x24A12",
          "expected_hex": "a401",
          "replacement_hex": "4001",
          "meaning": "CMP AR6: 420 to 320 deci-C"
        },
        {
          "offset": "0x24B7A",
          "expected_hex": "7bf4",
          "replacement_hex": "73f3",
          "meaning": "MOVIZ curve slope high half for 0.23333333432674408"
        },
        {
          "offset": "0x24B7C",
          "expected_hex": "b0e849f8",
          "replacement_hex": "b0e8c9eb",
          "meaning": "ADDF32 curve origin: -450.0 to -350.0 deci-C"
        },
        {
          "offset": "0x24B80",
          "expected_hex": "0ae84be1",
          "replacement_hex": "0fe87b77",
          "meaning": "MOVXI curve slope low half for 0.23333333432674408"
        }
      ],
      "changed_offsets": [
        "0x24A04",
        "0x24A12",
        "0x24B7A",
        "0x24B7B",
        "0x24B7E",
        "0x24B7F",
        "0x24B80",
        "0x24B82",
        "0x24B83"
      ],
      "output_sha256": "6dcd6995a772e6a1a228e1c78e05f0a53d9c441f4e9ae517fe4f61930ee7778f",
      "evidence": {
        "static_encoding": "confirmed-static",
        "candidate_identity": "confirmed-static",
        "runtime": "not-established",
        "runtime_document": null
      }
    },
    "fan35C_max70C_off32C": {
      "start_c": 35,
      "max_c": 70,
      "stop_c": 32,
      "curve_origin_c": 35,
      "slope_f32": 0.20000000298023224,
      "patches": [
        {
          "offset": "0x24A04",
          "expected_hex": "c201",
          "replacement_hex": "5e01",
          "meaning": "CMP AR6: 450 to 350 deci-C"
        },
        {
          "offset": "0x24A12",
          "expected_hex": "a401",
          "replacement_hex": "4001",
          "meaning": "CMP AR6: 420 to 320 deci-C"
        },
        {
          "offset": "0x24B7A",
          "expected_hex": "7bf4",
          "replacement_hex": "63f2",
          "meaning": "MOVIZ curve slope high half for 0.20000000298023224"
        },
        {
          "offset": "0x24B7C",
          "expected_hex": "b0e849f8",
          "replacement_hex": "b0e8c9eb",
          "meaning": "ADDF32 curve origin: -450.0 to -350.0 deci-C"
        },
        {
          "offset": "0x24B80",
          "expected_hex": "0ae84be1",
          "replacement_hex": "0ee86b66",
          "meaning": "MOVXI curve slope low half for 0.20000000298023224"
        }
      ],
      "changed_offsets": [
        "0x24A04",
        "0x24A12",
        "0x24B7A",
        "0x24B7B",
        "0x24B7E",
        "0x24B7F",
        "0x24B80",
        "0x24B82",
        "0x24B83"
      ],
      "output_sha256": "78f775a5eb47cc4f6f98fa0af40c1805cf2b5d492637c30c28035f947a318de9",
      "evidence": {
        "static_encoding": "confirmed-static",
        "candidate_identity": "confirmed-static",
        "runtime": "not-established",
        "runtime_document": null
      }
    },
    "fan40C_max50C_off37C": {
      "start_c": 40,
      "max_c": 50,
      "stop_c": 37,
      "curve_origin_c": 40,
      "slope_f32": 0.699999988079071,
      "patches": [
        {
          "offset": "0x24A04",
          "expected_hex": "c201",
          "replacement_hex": "9001",
          "meaning": "CMP AR6: 450 to 400 deci-C"
        },
        {
          "offset": "0x24A12",
          "expected_hex": "a401",
          "replacement_hex": "7201",
          "meaning": "CMP AR6: 420 to 370 deci-C"
        },
        {
          "offset": "0x24B7A",
          "expected_hex": "7bf4",
          "replacement_hex": "9bf9",
          "meaning": "MOVIZ curve slope high half for 0.699999988079071"
        },
        {
          "offset": "0x24B7C",
          "expected_hex": "b0e849f8",
          "replacement_hex": "b0e809f2",
          "meaning": "ADDF32 curve origin: -450.0 to -400.0 deci-C"
        },
        {
          "offset": "0x24B80",
          "expected_hex": "0ae84be1",